<?xml version="1.0" encoding="ISO-8859-15"?>
<?xml-stylesheet type="text/xsl" href=".\B3h_TRF_v1.0.xsl"?>
<Informacion_Tarifas TipoTLV="B3h" Version="1.0" xmlns:xsi="http://www.w3.org/2001/XMLSchema-instance" xsi:noNamespaceSchemaLocation=".\B3h_TRF_v1.0.xsd">
 <Titulo Codigo="100Bh">
  <Empresa_Propietaria_Cod>01h</Empresa_Propietaria_Cod>
  <Perfil Codigo="01h">
      <Empresa_Propietaria_Perf>01h</Empresa_Propietaria_Perf>
      <Tarifa>
         <Tipo_Unidades>02h</Tipo_Unidades>      
         <Unidades>54600</Unidades>
         <Fecha_Inicio_Admision>01/01/2019</Fecha_Inicio_Admision>
         <Fecha_Cambio_Tarifa>01/01/2020</Fecha_Cambio_Tarifa>
         <Fecha_Fin_Admision>11/02/2020</Fecha_Fin_Admision>
      </Tarifa>
      <Tarifa>
         <Tipo_Unidades>02h</Tipo_Unidades>
         <Unidades>54600</Unidades>
         <Fecha_Inicio_Admision>01/11/2019</Fecha_Inicio_Admision>
         <Fecha_Cambio_Tarifa>19/03/2024</Fecha_Cambio_Tarifa>
         <Fecha_Fin_Admision>20/03/2025</Fecha_Fin_Admision>
      </Tarifa>
  </Perfil>
  <Perfil Codigo="03h">
      <Empresa_Propietaria_Perf>01h</Empresa_Propietaria_Perf>
      <Tarifa>
         <Tipo_Unidades>02h</Tipo_Unidades>
         <Unidades>35000</Unidades>
         <Fecha_Inicio_Admision>01/01/2019</Fecha_Inicio_Admision>
         <Fecha_Cambio_Tarifa>01/01/2020</Fecha_Cambio_Tarifa>
         <Fecha_Fin_Admision>11/02/2020</Fecha_Fin_Admision>
      </Tarifa>
      <Tarifa>
         <Tipo_Unidades>02h</Tipo_Unidades>
         <Unidades>35000</Unidades>
         <Fecha_Inicio_Admision>01/11/2019</Fecha_Inicio_Admision>
         <Fecha_Cambio_Tarifa>19/03/2024</Fecha_Cambio_Tarifa>
         <Fecha_Fin_Admision>20/03/2025</Fecha_Fin_Admision>
      </Tarifa>
  </Perfil>
 </Titulo>
 <Titulo Codigo="100Ch">
  <Empresa_Propietaria_Cod>01h</Empresa_Propietaria_Cod>
  <Perfil Codigo="01h">
      <Empresa_Propietaria_Perf>01h</Empresa_Propietaria_Perf>
      <Tarifa>
         <Tipo_Unidades>02h</Tipo_Unidades>
         <Unidades>63700</Unidades>
         <Fecha_Inicio_Admision>01/01/2019</Fecha_Inicio_Admision>
         <Fecha_Cambio_Tarifa>01/01/2020</Fecha_Cambio_Tarifa>
         <Fecha_Fin_Admision>11/02/2020</Fecha_Fin_Admision>
      </Tarifa>
      <Tarifa>
         <Tipo_Unidades>02h</Tipo_Unidades>
         <Unidades>63700</Unidades>
         <Fecha_Inicio_Admision>01/11/2019</Fecha_Inicio_Admision>
         <Fecha_Cambio_Tarifa>19/03/2024</Fecha_Cambio_Tarifa>
         <Fecha_Fin_Admision>20/03/2025</Fecha_Fin_Admision>
      </Tarifa>
  </Perfil>
  <Perfil Codigo="03h">
      <Empresa_Propietaria_Perf>01h</Empresa_Propietaria_Perf>
      <Tarifa>
         <Tipo_Unidades>02h</Tipo_Unidades>
         <Unidades>39600</Unidades>
         <Fecha_Inicio_Admision>01/01/2019</Fecha_Inicio_Admision>
         <Fecha_Cambio_Tarifa>01/01/2020</Fecha_Cambio_Tarifa>
         <Fecha_Fin_Admision>11/02/2020</Fecha_Fin_Admision>
      </Tarifa>
      <Tarifa>
         <Tipo_Unidades>02h</Tipo_Unidades>
         <Unidades>39600</Unidades>
         <Fecha_Inicio_Admision>01/11/2019</Fecha_Inicio_Admision>
         <Fecha_Cambio_Tarifa>19/03/2024</Fecha_Cambio_Tarifa>
         <Fecha_Fin_Admision>20/03/2025</Fecha_Fin_Admision>
      </Tarifa>
  </Perfil>
 </Titulo>
 <Titulo Codigo="100Dh">
  <Empresa_Propietaria_Cod>01h</Empresa_Propietaria_Cod>
  <Perfil Codigo="01h">
      <Empresa_Propietaria_Perf>01h</Empresa_Propietaria_Perf>
      <Tarifa>
         <Tipo_Unidades>02h</Tipo_Unidades>
         <Unidades>72000</Unidades>
         <Fecha_Inicio_Admision>01/01/2019</Fecha_Inicio_Admision>
         <Fecha_Cambio_Tarifa>01/01/2020</Fecha_Cambio_Tarifa>
         <Fecha_Fin_Admision>11/02/2020</Fecha_Fin_Admision>
      </Tarifa>
      <Tarifa>
         <Tipo_Unidades>02h</Tipo_Unidades>
         <Unidades>72000</Unidades>
         <Fecha_Inicio_Admision>01/11/2019</Fecha_Inicio_Admision>
         <Fecha_Cambio_Tarifa>19/03/2024</Fecha_Cambio_Tarifa>
         <Fecha_Fin_Admision>20/03/2025</Fecha_Fin_Admision>
      </Tarifa>
  </Perfil>
  <Perfil Codigo="03h">
      <Empresa_Propietaria_Perf>01h</Empresa_Propietaria_Perf>
      <Tarifa>
         <Tipo_Unidades>02h</Tipo_Unidades>
         <Unidades>45000</Unidades>
         <Fecha_Inicio_Admision>01/01/2019</Fecha_Inicio_Admision>
         <Fecha_Cambio_Tarifa>01/01/2020</Fecha_Cambio_Tarifa>
         <Fecha_Fin_Admision>11/02/2020</Fecha_Fin_Admision>
      </Tarifa>
      <Tarifa>
         <Tipo_Unidades>02h</Tipo_Unidades>
         <Unidades>45000</Unidades>
         <Fecha_Inicio_Admision>01/11/2019</Fecha_Inicio_Admision>
         <Fecha_Cambio_Tarifa>19/03/2024</Fecha_Cambio_Tarifa>
         <Fecha_Fin_Admision>20/03/2025</Fecha_Fin_Admision>
      </Tarifa>
  </Perfil>
 </Titulo>
 <Titulo Codigo="100Eh">
  <Empresa_Propietaria_Cod>01h</Empresa_Propietaria_Cod>
  <Perfil Codigo="01h">
      <Empresa_Propietaria_Perf>01h</Empresa_Propietaria_Perf>
      <Tarifa>
         <Tipo_Unidades>02h</Tipo_Unidades>
         <Unidades>82000</Unidades>
         <Fecha_Inicio_Admision>01/01/2019</Fecha_Inicio_Admision>
         <Fecha_Cambio_Tarifa>01/01/2020</Fecha_Cambio_Tarifa>
         <Fecha_Fin_Admision>11/02/2020</Fecha_Fin_Admision>
      </Tarifa>
      <Tarifa>
         <Tipo_Unidades>02h</Tipo_Unidades>
         <Unidades>82000</Unidades>
         <Fecha_Inicio_Admision>01/11/2019</Fecha_Inicio_Admision>
         <Fecha_Cambio_Tarifa>19/03/2024</Fecha_Cambio_Tarifa>
         <Fecha_Fin_Admision>20/03/2025</Fecha_Fin_Admision>
      </Tarifa>
  </Perfil>
  <Perfil Codigo="03h">
      <Empresa_Propietaria_Perf>01h</Empresa_Propietaria_Perf>
      <Tarifa>
         <Tipo_Unidades>02h</Tipo_Unidades>
         <Unidades>51600</Unidades>
         <Fecha_Inicio_Admision>01/01/2019</Fecha_Inicio_Admision>
         <Fecha_Cambio_Tarifa>01/01/2020</Fecha_Cambio_Tarifa>
         <Fecha_Fin_Admision>11/02/2020</Fecha_Fin_Admision>
      </Tarifa>
      <Tarifa>
         <Tipo_Unidades>02h</Tipo_Unidades>
         <Unidades>51600</Unidades>
         <Fecha_Inicio_Admision>01/11/2019</Fecha_Inicio_Admision>
         <Fecha_Cambio_Tarifa>19/03/2024</Fecha_Cambio_Tarifa>
         <Fecha_Fin_Admision>20/03/2025</Fecha_Fin_Admision>
      </Tarifa>
  </Perfil>
 </Titulo>
 <Titulo Codigo="100Fh">
  <Empresa_Propietaria_Cod>01h</Empresa_Propietaria_Cod>
  <Perfil Codigo="01h">
      <Empresa_Propietaria_Perf>01h</Empresa_Propietaria_Perf>
      <Tarifa>
         <Tipo_Unidades>02h</Tipo_Unidades>
         <Unidades>89500</Unidades>
         <Fecha_Inicio_Admision>01/01/2019</Fecha_Inicio_Admision>
         <Fecha_Cambio_Tarifa>01/01/2020</Fecha_Cambio_Tarifa>
         <Fecha_Fin_Admision>11/02/2020</Fecha_Fin_Admision>
      </Tarifa>
      <Tarifa>
         <Tipo_Unidades>02h</Tipo_Unidades>
         <Unidades>89500</Unidades>
         <Fecha_Inicio_Admision>01/11/2019</Fecha_Inicio_Admision>
         <Fecha_Cambio_Tarifa>19/03/2024</Fecha_Cambio_Tarifa>
         <Fecha_Fin_Admision>20/03/2025</Fecha_Fin_Admision>
      </Tarifa>
  </Perfil>
  <Perfil Codigo="03h">
      <Empresa_Propietaria_Perf>01h</Empresa_Propietaria_Perf>
      <Tarifa>
         <Tipo_Unidades>02h</Tipo_Unidades>
         <Unidades>56200</Unidades>
         <Fecha_Inicio_Admision>01/01/2019</Fecha_Inicio_Admision>
         <Fecha_Cambio_Tarifa>01/01/2020</Fecha_Cambio_Tarifa>
         <Fecha_Fin_Admision>11/02/2020</Fecha_Fin_Admision>
      </Tarifa>
      <Tarifa>
         <Tipo_Unidades>02h</Tipo_Unidades>
         <Unidades>56200</Unidades>
         <Fecha_Inicio_Admision>01/11/2019</Fecha_Inicio_Admision>
         <Fecha_Cambio_Tarifa>19/03/2024</Fecha_Cambio_Tarifa>
         <Fecha_Fin_Admision>20/03/2025</Fecha_Fin_Admision>
      </Tarifa>
  </Perfil>
 </Titulo>
 <Titulo Codigo="1001h">
  <Empresa_Propietaria_Cod>01h</Empresa_Propietaria_Cod>
  <Perfil Codigo="01h">
      <Empresa_Propietaria_Perf>01h</Empresa_Propietaria_Perf>
      <Tarifa>
         <Tipo_Unidades>02h</Tipo_Unidades>
         <Unidades>5460</Unidades>
         <Fecha_Inicio_Admision>01/01/2019</Fecha_Inicio_Admision>
         <Fecha_Cambio_Tarifa>01/01/2020</Fecha_Cambio_Tarifa>
         <Fecha_Fin_Admision>11/02/2020</Fecha_Fin_Admision>
      </Tarifa>
      <Tarifa>
         <Tipo_Unidades>02h</Tipo_Unidades>
         <Unidades>5460</Unidades>
         <Fecha_Inicio_Admision>01/11/2019</Fecha_Inicio_Admision>
         <Fecha_Cambio_Tarifa>19/03/2024</Fecha_Cambio_Tarifa>
         <Fecha_Fin_Admision>20/03/2025</Fecha_Fin_Admision>
      </Tarifa>
  </Perfil>
 </Titulo>
 <Titulo Codigo="1002h">
  <Empresa_Propietaria_Cod>01h</Empresa_Propietaria_Cod>
  <Perfil Codigo="01h">
      <Empresa_Propietaria_Perf>01h</Empresa_Propietaria_Perf>
      <Tarifa>
         <Tipo_Unidades>02h</Tipo_Unidades>
         <Unidades>6370</Unidades>
         <Fecha_Inicio_Admision>01/01/2019</Fecha_Inicio_Admision>
         <Fecha_Cambio_Tarifa>01/01/2020</Fecha_Cambio_Tarifa>
         <Fecha_Fin_Admision>11/02/2020</Fecha_Fin_Admision>
      </Tarifa>
      <Tarifa>
         <Tipo_Unidades>02h</Tipo_Unidades>
         <Unidades>6370</Unidades>
         <Fecha_Inicio_Admision>01/11/2019</Fecha_Inicio_Admision>
         <Fecha_Cambio_Tarifa>19/03/2024</Fecha_Cambio_Tarifa>
         <Fecha_Fin_Admision>20/03/2025</Fecha_Fin_Admision>
      </Tarifa>
  </Perfil>
 </Titulo>
 <Titulo Codigo="1003h">
  <Empresa_Propietaria_Cod>01h</Empresa_Propietaria_Cod>
  <Perfil Codigo="01h">
      <Empresa_Propietaria_Perf>01h</Empresa_Propietaria_Perf>
      <Tarifa>
         <Tipo_Unidades>02h</Tipo_Unidades>
         <Unidades>7200</Unidades>
         <Fecha_Inicio_Admision>01/01/2019</Fecha_Inicio_Admision>
         <Fecha_Cambio_Tarifa>01/01/2020</Fecha_Cambio_Tarifa>
         <Fecha_Fin_Admision>11/02/2020</Fecha_Fin_Admision>
      </Tarifa>
      <Tarifa>
         <Tipo_Unidades>02h</Tipo_Unidades>
         <Unidades>7200</Unidades>
         <Fecha_Inicio_Admision>01/11/2019</Fecha_Inicio_Admision>